{
	"slug": "sedans",
	"generated": {
		"by": "bootstrap-research.py",
		"note": "Scaffolded from the existing corpus by bootstrap-research.py. NO EXTERNAL RESEARCH WAS PERFORMED. Every item is marked with the evidence level it actually has; nothing here may be treated as verified until a researcher answers the open questions and records a real source."
	},
	"primary_intent": "transactional",
	"secondary_intents": [
		"navigational_local",
		"commercial_investigation",
		"informational"
	],
	"user_stage": "solution_aware",
	"conversion_goal": "Phone call or instant-offer submission",
	"decision_questions": [
		{
			"question": "How much is my junk sedan worth?",
			"required_answer": "TO BE RESEARCHED",
			"status": "unresolved"
		},
		{
			"question": "Do you buy sedans that don't run?",
			"required_answer": "TO BE RESEARCHED",
			"status": "unresolved"
		},
		{
			"question": "Will you buy my sedan if it has high mileage?",
			"required_answer": "TO BE RESEARCHED",
			"status": "unresolved"
		},
		{
			"question": "Can I sell a sedan without a title in Las Vegas?",
			"required_answer": "TO BE RESEARCHED",
			"status": "unresolved"
		}
	],
	"objections": [
		{
			"objection": "Is the quoted price the price I actually get?",
			"response_requirement": "Needs a sourced statement of the firm-offer policy."
		},
		{
			"objection": "Can I sell without the title?",
			"response_requirement": "Needs an authoritative Nevada DMV source before answering."
		}
	],
	"queries": [
		{
			"query": "how much junk sedan worth",
			"intent": "transactional",
			"question": "How much is my junk sedan worth?",
			"satisfied_by": "",
			"provenance": "observed_in_existing_copy"
		},
		{
			"query": "buy sedans don't run",
			"intent": "transactional",
			"question": "Do you buy sedans that don't run?",
			"satisfied_by": "",
			"provenance": "observed_in_existing_copy"
		},
		{
			"query": "buy sedan high mileage",
			"intent": "transactional",
			"question": "Will you buy my sedan if it has high mileage?",
			"satisfied_by": "",
			"provenance": "observed_in_existing_copy"
		},
		{
			"query": "sell sedan without title las vegas",
			"intent": "transactional",
			"question": "Can I sell a sedan without a title in Las Vegas?",
			"satisfied_by": "",
			"provenance": "observed_in_existing_copy"
		}
	],
	"cannibalisation_risk": []
}
