{
	"slug": "spring-valley",
	"generated": {
		"by": "bootstrap-research.py",
		"note": "Scaffolded from the existing corpus by bootstrap-research.py. NO EXTERNAL RESEARCH WAS PERFORMED. Every item is marked with the evidence level it actually has; nothing here may be treated as verified until a researcher answers the open questions and records a real source."
	},
	"primary_intent": "navigational_local",
	"secondary_intents": [
		"transactional",
		"informational"
	],
	"user_stage": "solution_aware",
	"conversion_goal": "Phone call or instant-offer submission",
	"decision_questions": [
		{
			"question": "How fast can you pick up a junk car in Spring Valley?",
			"required_answer": "TO BE RESEARCHED",
			"status": "unresolved"
		},
		{
			"question": "Do you buy cars from apartment complexes in Spring Valley?",
			"required_answer": "TO BE RESEARCHED",
			"status": "unresolved"
		},
		{
			"question": "What's the minimum you'll pay for a junk car in Spring Valley?",
			"required_answer": "TO BE RESEARCHED",
			"status": "unresolved"
		},
		{
			"question": "Can I sell a car with a dead battery in Spring Valley?",
			"required_answer": "TO BE RESEARCHED",
			"status": "unresolved"
		}
	],
	"objections": [
		{
			"objection": "Is the quoted price the price I actually get?",
			"response_requirement": "Needs a sourced statement of the firm-offer policy."
		},
		{
			"objection": "Can I sell without the title?",
			"response_requirement": "Needs an authoritative Nevada DMV source before answering."
		}
	],
	"queries": [
		{
			"query": "how fast pick up junk car spring valley",
			"intent": "navigational_local",
			"question": "How fast can you pick up a junk car in Spring Valley?",
			"satisfied_by": "",
			"provenance": "observed_in_existing_copy"
		},
		{
			"query": "buy cars apartment complexes spring valley",
			"intent": "navigational_local",
			"question": "Do you buy cars from apartment complexes in Spring Valley?",
			"satisfied_by": "",
			"provenance": "observed_in_existing_copy"
		},
		{
			"query": "what's minimum you'll pay junk car spring valley",
			"intent": "navigational_local",
			"question": "What's the minimum you'll pay for a junk car in Spring Valley?",
			"satisfied_by": "",
			"provenance": "observed_in_existing_copy"
		},
		{
			"query": "sell car dead battery spring valley",
			"intent": "navigational_local",
			"question": "Can I sell a car with a dead battery in Spring Valley?",
			"satisfied_by": "",
			"provenance": "observed_in_existing_copy"
		}
	],
	"cannibalisation_risk": [
		{
			"with_page": "las-vegas",
			"severity": "high",
			"reason": "Same situation and FAQ substance as this sibling, differently worded."
		}
	]
}
