{
	"slug": "boulder-city",
	"generated": {
		"by": "bootstrap-research.py",
		"note": "Scaffolded from the existing corpus by bootstrap-research.py. NO EXTERNAL RESEARCH WAS PERFORMED. Every item is marked with the evidence level it actually has; nothing here may be treated as verified until a researcher answers the open questions and records a real source."
	},
	"primary_intent": "navigational_local",
	"secondary_intents": [
		"transactional",
		"informational"
	],
	"user_stage": "solution_aware",
	"conversion_goal": "Phone call or instant-offer submission",
	"decision_questions": [
		{
			"question": "Is towing really free from Boulder City?",
			"required_answer": "TO BE RESEARCHED",
			"status": "unresolved"
		},
		{
			"question": "How quickly can you pick up a car in Boulder City?",
			"required_answer": "TO BE RESEARCHED",
			"status": "unresolved"
		},
		{
			"question": "Do you buy junk cars in the Boulder City historic district?",
			"required_answer": "TO BE RESEARCHED",
			"status": "unresolved"
		},
		{
			"question": "What types of vehicles do you buy in Boulder City?",
			"required_answer": "TO BE RESEARCHED",
			"status": "unresolved"
		}
	],
	"objections": [
		{
			"objection": "Is the quoted price the price I actually get?",
			"response_requirement": "Needs a sourced statement of the firm-offer policy."
		},
		{
			"objection": "Can I sell without the title?",
			"response_requirement": "Needs an authoritative Nevada DMV source before answering."
		}
	],
	"queries": [
		{
			"query": "towing really free boulder city",
			"intent": "navigational_local",
			"question": "Is towing really free from Boulder City?",
			"satisfied_by": "",
			"provenance": "observed_in_existing_copy"
		},
		{
			"query": "how quickly pick up car boulder city",
			"intent": "navigational_local",
			"question": "How quickly can you pick up a car in Boulder City?",
			"satisfied_by": "",
			"provenance": "observed_in_existing_copy"
		},
		{
			"query": "buy junk cars boulder city historic district",
			"intent": "navigational_local",
			"question": "Do you buy junk cars in the Boulder City historic district?",
			"satisfied_by": "",
			"provenance": "observed_in_existing_copy"
		},
		{
			"query": "what types vehicles buy boulder city",
			"intent": "navigational_local",
			"question": "What types of vehicles do you buy in Boulder City?",
			"satisfied_by": "",
			"provenance": "observed_in_existing_copy"
		}
	],
	"cannibalisation_risk": []
}
